index,author,url,recipeTitle,commentBody,commentType,userID,commentRecommendations,ai_guess,recipeScore,numberOfRatings,sentiment,readable_ai_guess
9,Lisa Donovan,https://cooking.nytimes.com/recipes/1026742-old-fashioned-coconut-cake,Old-Fashioned Coconut Cake Recipe,"This version of the cake is unfamiliar to this Southerner, but it's an excellent recipe.  The Swiss buttercream is far better than the usually over-unctuous American buttercream.  I still prefer a lighter frosting for coconut cake.  For those hesitant to use the sugar, choose another cake.  Coconut cake is traditionally very sweet, and it fades if it's not supported adequately by sugar.  That said, the 2 cups of sugar can be reduced by about 1/3 cup without doing real damage.",comment,193908654,220,positive_user_describing_changes,5,195,positive,Liked recipe but made changes
9,Lisa Donovan,https://cooking.nytimes.com/recipes/1026742-old-fashioned-coconut-cake,Old-Fashioned Coconut Cake Recipe,"This is an excellent version of coconut cake, though it's unfamiliar to this Southerner.  The Swiss buttercream works far better than the heavy and overly-unctuous American buttercream.",comment,193908654,12,positive_user_made_as_written,5,195,positive,Liked recipe and prepared as written
8,Julia Moskin,https://cooking.nytimes.com/recipes/1024686-coq-au-vin-blanc-meatballs,Coq au Vin Blanc Meatballs Recipe,"This is very tasty, but it has nothing at all to do with coq au vin.  Instead, it's a play on the basic French combinations of wine and cream, with the fabulous underflavors of mushroom and bacon.  Think more along the lines of Julia Child's wonderful recipe for poulet au porto.",comment,193908654,30,thinks_recipe_is_inauthentic,4,768,negative,Thought the recipe was inauthentic
20,Kenji López-Alt,https://cooking.nytimes.com/recipes/1023012-san-francisco-style-vietnamese-american-garlic-noodles,San Francisco-Style Vietnamese American Garlic Noodles Recipe,"Why would anyone eat ""San Francisco style"" Vietnamese food?  The largest Vietnamese population is 45 minutes away in San Jose.  And the Vietnamese culinary capital in this country is Houston.",comment,193908654,0,thinks_recipe_is_inauthentic,4,"10,943",negative,Thought the recipe was inauthentic
29,Kenji López-Alt,https://cooking.nytimes.com/recipes/1023147-tuna-crunch-sandwiches,Tuna Crunch Sandwiches Recipe,"The tuna salad itself is good, though quite standard.  Putting chips inside the finished product is an affectation.  Plus, they quickly loose their crunch from the liquid ingredients.",comment,193908654,0,thinks_recipe_is_flawed_due_to_technique_or_equipment,4,"1,465",negative,Didn't like recipe due to technique or equipment
44,Eric Kim,https://cooking.nytimes.com/recipes/1026386-caramelized-kimchi-baked-potatoes,Caramelized Kimchi Baked Potatoes Recipe,"Nothing ""steps in"" for bacon.  Especially kimchi topped with sour cream.  Seriously?",comment,193908654,0,thinks_recipe_is_flawed_due_to_flavor,5,224,negative,Didn't like recipe due to flavor
26,Yotam Ottolenghi,https://cooking.nytimes.com/recipes/1025150-grilled-asparagus-with-miso-and-olives,Grilled Asparagus With Miso and Olives Recipe,"The sauce seriously overpowers the flavor of the asparagus and is much too heavy for this delicate and wonderful vegetable.  The dill is optional, fortunately; dill does not complement asparagus at all.  Nothing is better than asparagus, butter, and a bit of salt.",comment,193908654,103,thinks_recipe_is_flawed_due_to_flavor,4,632,negative,Didn't like recipe due to flavor
18,Priya Krishna,https://cooking.nytimes.com/recipes/1023783-pistachio-bundt-cake,Pistachio Bundt Cake Recipe,"I don't understand the enthusiasm for this cake.  The pudding mix (and the rather odd marshmallow base) gave it a soft, somewhat spongy, texture.  More importantly, the cake has almost no pistachio flavor.  You'll have to add extract or a pistachio paste to make it really worthwhile.  I won't remake it.",comment,193908654,0,thinks_recipe_is_flawed_due_to_flavor,4,"1,046",negative,Didn't like recipe due to flavor
6,Melissa Clark,https://cooking.nytimes.com/recipes/1023880-vegetarian-tamale-pie,Vegetarian Tamale Pie Recipe,Why would I grate garlic cloves when I can just put them through a much simpler garlic press?,comment,193908654,18,thinks_recipe_is_flawed_due_to_technique_or_equipment,4,"3,203",negative,Didn't like recipe due to technique or equipment
