index,author,url,recipeTitle,commentBody,commentType,userID,commentRecommendations,ai_guess,recipeScore,numberOfRatings,sentiment,readable_ai_guess
19,Priya Krishna,https://cooking.nytimes.com/recipes/1023785-magnolia-bakerys-banana-pudding,Magnolia Bakery’s Banana Pudding Recipe,"Indeed there are much better alternatives than those boxes of nilla wafers, as good ad swamp crackers. Any of the fine digestives are much better",comment,65537845,0,positive_user_describing_changes,4,"4,983",positive,Liked recipe but made changes
36,Priya Krishna,https://cooking.nytimes.com/recipes/1020139-garlic-ginger-chicken-breasts-with-cilantro-and-mint,Garlic-Ginger Chicken Breasts With Cilantro and Mint Recipe,Made it last night. Delicious!!!!!,comment,65537845,0,positive_user_made_as_written,4,"3,298",positive,Liked recipe and prepared as written
0,Alexa Weibel,https://cooking.nytimes.com/recipes/774980183-spicy-broccoli-rabe-pasta,Spicy Broccoli Rabe Pasta Recipe,What if you omit the pepper flakes?,comment,65537845,0,question,5,223,neutral,Commenter asking a question
8,Alexa Weibel,https://cooking.nytimes.com/recipes/1026264-steak-au-poivre-for-two,Steak au Poivre for Two Recipe,Why not crush the peppercorns in a mortar and pestle?,comment,65537845,1,question,5,787,neutral,Commenter asking a question
8,Alexa Weibel,https://cooking.nytimes.com/recipes/1026264-steak-au-poivre-for-two,Steak au Poivre for Two Recipe,I used my electric pepper mill with the grind setting on coarse to get the desired large bits of pepper flakes. Worked pop perfectly,comment,65537845,0,positive_user_describing_changes,5,787,positive,Liked recipe but made changes
45,Alexa Weibel,https://cooking.nytimes.com/recipes/1023767-el-cholos-sonora-style-enchiladas,El Cholo’s Sonora-Style Enchiladas Recipe,This is an extraordinary preparation. This a time consuming for starters. It is more of a restaurant prep rather than a standard effort for the home cook. Making both sauces enabled me to use a pile of pots and an incredibly difficult clean up. The directions and method were a jumble of directives not easily followed. Finally after hours making this I served it. It was delicious. I’d like to  simplify this maybe with one sauce or at best to find a restaurant that does this style of cooking.,comment,65537845,9,thinks_recipe_is_flawed_due_to_technique_or_equipment,4,509,negative,Didn't like recipe due to technique or equipment
45,Alexa Weibel,https://cooking.nytimes.com/recipes/1023767-el-cholos-sonora-style-enchiladas,El Cholo’s Sonora-Style Enchiladas Recipe,So these are not tortillas wrapped around the filling? You stack sauce and filling. I’m making it with just one of the sauces to save time to use up my leftover roast chicken,comment,65537845,1,question,4,509,neutral,Commenter asking a question
4,Melissa Clark,https://cooking.nytimes.com/recipes/778097361-lemon-chicken-with-asparagus,Lemon Chicken With Asparagus Recipe,"I got my first local asparagus yesterday from Beth’s farmers market in Warren, ME. I poached the spears in water and dressed with Via Carota’s famous vinaigrette made with shallots and sherry vinegar. Divine. The market is about 12 miles from home but worth the time and gas money to go to this market. Picked up local rhubarb, too. In Midcoast maine the farmers markets are still shy of produce. We’re all waiting for the first baby carrots., strawberries and new potatoes",comment,65537845,92,maybe_not_about_the_recipe,5,746,neutral,Off-topic
4,Melissa Clark,https://cooking.nytimes.com/recipes/778097361-lemon-chicken-with-asparagus,Lemon Chicken With Asparagus Recipe,Instead of worrying about overcooking the white meat I think the better route is not to overcook the asparagus as they cook alongside the chicken in the last 20 minutes. Test after 10 to 15 minutes. Nonetheless I will make this again with locally available asparagus and add a few small new potatoes. It was a delicious dish. The leftovers will be great tonight used in chicken enchilada casserole,comment,65537845,34,positive_user_describing_changes,5,746,positive,Liked recipe but made changes
25,Melissa Clark,https://cooking.nytimes.com/recipes/1027572-lemon-garlic-brisket,Lemon-Garlic Brisket Recipe,"This was a wonderful article and explains your interest and expertise in food and food writing. What an exciting time around the family dinner table  you must have had, full of culinary surprises. I’ll try your lemony brisket though the flavor of lemon seems off in this dish but will hold off commenting more until I’ve tried it.",comment,65537845,3,thinks_recipe_is_flawed_due_to_flavor,5,307,negative,Didn't like recipe due to flavor
27,Melissa Clark,https://cooking.nytimes.com/recipes/1027513-classic-thanksgiving-turkey,Classic Thanksgiving Turkey Recipe,"I have always draped the breast portion with cheesecloth soaked in  butter, which gets removed about half hour before the turkey is done. Also still grease the breast portion with butter or olive oil before covering with cheesecloth. The breast is always moist as a result.",comment,65537845,0,positive_user_describing_changes,5,610,positive,Liked recipe but made changes
35,Melissa Clark,https://cooking.nytimes.com/recipes/1027323-roasted-chicken-with-vinegared-grapes,Roasted Chicken With Vinegared Grapes Recipe,"Look in any British cookbook and you’re apt to find boiled chicken or turkey, my favorite with green  grape white sauce",comment,65537845,3,maybe_not_about_the_recipe,4,121,neutral,Off-topic
41,Melissa Clark,https://cooking.nytimes.com/recipes/1026618-turkey-meatloaf-with-parmesan-and-red-wine,Turkey Meatloaf With Parmesan and Red Wine Recipe,"This was just awful. Dry, tasteless and total waste of good enough ingredients. Even the tomato mixture was ill conceived",comment,65537845,1,thinks_recipe_is_flawed_due_to_flavor,4,749,negative,Didn't like recipe due to flavor
42,Melissa Clark,https://cooking.nytimes.com/recipes/1026542-baked-lemon-pudding-with-blueberry-jam,Baked Lemon Pudding With Blueberry Jam Recipe,This was very pleasant and indeed very lemony.,comment,65537845,1,positive_user_made_as_written,5,639,positive,Liked recipe and prepared as written
2,Claire Saffitz,https://cooking.nytimes.com/recipes/779827704-lemon-basque-cheesecake,Lemon Basque Cheesecake Recipe,This seems like a formidable recipe but I bet it’s absolutely wonderful and worth the time and effort,comment,65537845,10,maybe_not_about_the_recipe,5,55,neutral,Off-topic
5,Claire Saffitz,https://cooking.nytimes.com/recipes/772052394-sheet-pan-tarte-tatin,Sheet Pan Tarte Tatin Recipe,What about a smaller version?,comment,65537845,0,question,4,26,neutral,Commenter asking a question
22,Claire Saffitz,https://cooking.nytimes.com/recipes/1024760-chocolate-layer-cake,Chocolate Layer Cake Recipe,"Full fat buttermilk is a misnomer. It means that it’s pure buttermilk made from cream with little flecks of butter in the milk. It has no cultures and has a short shelf life. I used to drive 50 miles to an old fashioned dairy farm with the most intense raw butter, milk and cream and their buttery butter milk. Generally I use Kate’s buttermilk available in most stores in Maine. I think it fits term full fat an item used in the south",comment,65537845,0,maybe_not_about_the_recipe,5,"1,224",neutral,Off-topic
32,Claire Saffitz,https://cooking.nytimes.com/recipes/1023686-one-day-fruitcake,One-Day Fruitcake Recipe,“Brush” the pan with butter? Does that mean it’s melted?,comment,65537845,0,question,4,573,neutral,Commenter asking a question
